{
  "schemaVersion": "1.0",
  "traceId": "fixture-radiators-legacy-house",
  "lead": {
    "sessionId": "sess-002"
  },
  "building": {
    "total_area": 165,
    "heated_area": 150,
    "construction_year": 1992,
    "building_type": "single_house",
    "heating_type": "grzejniki",
    "source_type": "air-water",
    "location_id": "PL_IV",
    "include_hot_water": "yes",
    "hot_water_persons": 5,
    "hot_water_usage": "bath"
  },
  "preferences": {
    "hasBuffer": true,
    "heating": {
      "emitterType": "radiators"
    },
    "dhw": {
      "enabled": true,
      "persons": 5,
      "usageProfile": "bath"
    },
    "options": {
      "pumpOptionId": "split400"
    }
  },
  "context": {
    "source": "harness",
    "channel": "calculator"
  }
}
