{
  "schemaVersion": "1.0",
  "traceId": "fixture-mixed-types-coercion",
  "lead": {
    "sessionId": "sess-007"
  },
  "building": {
    "total_area": "140",
    "heated_area": "136",
    "construction_year": "2001",
    "heating_type": "podlogowe",
    "location_id": "PL_III",
    "include_hot_water": "1",
    "hot_water_persons": "4",
    "hot_water_usage": "shower_bath"
  },
  "preferences": {
    "hasBuffer": "1",
    "heating": {
      "emitterType": "floor_heating"
    },
    "dhw": {
      "enabled": "true",
      "persons": "4",
      "usageProfile": "shower_bath"
    },
    "options": {
      "pumpOptionId": "split"
    }
  },
  "context": {
    "source": "harness",
    "channel": "api"
  }
}
