{
  "schemaVersion": "1.0",
  "traceId": "fixture-no-dhw-no-buffer",
  "lead": {
    "sessionId": "sess-003"
  },
  "building": {
    "total_area": 92,
    "heated_area": 88,
    "construction_year": 2022,
    "building_type": "single_house",
    "heating_type": "podlogowe",
    "location_id": "PL_II",
    "include_hot_water": "no"
  },
  "preferences": {
    "hasBuffer": false,
    "heating": {
      "emitterType": "floor_heating"
    },
    "dhw": {
      "enabled": false,
      "persons": 0,
      "usageProfile": "shower"
    },
    "options": {
      "pumpOptionId": "split"
    }
  },
  "context": {
    "source": "harness",
    "channel": "configurator"
  }
}
