{
  "schemaVersion": "1.0",
  "traceId": "fixture-baseline-floor-heating",
  "lead": {
    "sessionId": "sess-001"
  },
  "building": {
    "total_area": 135,
    "heated_area": 135,
    "construction_year": 2018,
    "building_type": "single_house",
    "heating_type": "podlogowe",
    "source_type": "air-water",
    "location_id": "PL_III",
    "include_hot_water": "yes",
    "hot_water_persons": 4,
    "hot_water_usage": "shower_bath"
  },
  "preferences": {
    "hasBuffer": true,
    "heating": {
      "emitterType": "floor_heating"
    },
    "dhw": {
      "enabled": true,
      "persons": 4,
      "usageProfile": "shower_bath"
    },
    "options": {
      "pumpOptionId": "split"
    }
  },
  "context": {
    "source": "harness",
    "channel": "configurator"
  }
}
