{
  "schemaVersion": "1.0",
  "traceId": "fixture-high-demand-bivalent",
  "lead": {
    "sessionId": "sess-005"
  },
  "building": {
    "total_area": 280,
    "heated_area": 260,
    "construction_year": 1985,
    "building_type": "single_house",
    "heating_type": "grzejniki",
    "source_type": "air-water",
    "location_id": "PL_V",
    "include_hot_water": "yes",
    "hot_water_persons": 6,
    "hot_water_usage": "bath",
    "bivalent_source_type": "solid_fuel"
  },
  "preferences": {
    "hasBuffer": true,
    "heating": {
      "emitterType": "radiators"
    },
    "dhw": {
      "enabled": true,
      "persons": 6,
      "usageProfile": "bath"
    },
    "options": {
      "pumpOptionId": "split400"
    }
  },
  "context": {
    "source": "harness",
    "channel": "calculator"
  }
}
